[
  {
    "module_id": "intro",
    "question_id": "intro-01",
    "prompt": "Which of the following correctly creates a string variable holding Hlomla?",
    "type": "mcq",
    "options": [
      "name = Hlomla",
      "name = 'Hlomla'",
      "name = (Hlomla)",
      "name = <Hlomla>"
    ],
    "answer": "name = 'Hlomla'",
    "misconception_map": {
      "name = Hlomla": "strings_need_quotes"
    },
    "xp": 10
  },
  {
    "module_id": "intro",
    "question_id": "intro-02",
    "prompt": "Which of the following correctly creates a string variable holding Cape Town?",
    "type": "mcq",
    "options": [
      "name = Cape Town",
      "name = 'Cape Town'",
      "name = (Cape Town)",
      "name = <Cape Town>"
    ],
    "answer": "name = 'Cape Town'",
    "misconception_map": {
      "name = Cape Town": "strings_need_quotes"
    },
    "xp": 10
  },
  {
    "module_id": "intro",
    "question_id": "intro-03",
    "prompt": "Which of the following correctly creates a string variable holding Xhosa?",
    "type": "mcq",
    "options": [
      "name = Xhosa",
      "name = 'Xhosa'",
      "name = (Xhosa)",
      "name = <Xhosa>"
    ],
    "answer": "name = 'Xhosa'",
    "misconception_map": {
      "name = Xhosa": "strings_need_quotes"
    },
    "xp": 10
  },
  {
    "module_id": "intro",
    "question_id": "intro-04",
    "prompt": "Which of the following correctly creates a string variable holding Python?",
    "type": "mcq",
    "options": [
      "name = Python",
      "name = 'Python'",
      "name = (Python)",
      "name = <Python>"
    ],
    "answer": "name = 'Python'",
    "misconception_map": {
      "name = Python": "strings_need_quotes"
    },
    "xp": 10
  },
  {
    "module_id": "intro",
    "question_id": "intro-05",
    "prompt": "Which of the following correctly creates a string variable holding Firebase?",
    "type": "mcq",
    "options": [
      "name = Firebase",
      "name = 'Firebase'",
      "name = (Firebase)",
      "name = <Firebase>"
    ],
    "answer": "name = 'Firebase'",
    "misconception_map": {
      "name = Firebase": "strings_need_quotes"
    },
    "xp": 10
  },
  {
    "module_id": "intro",
    "question_id": "intro-06",
    "prompt": "Select all of the following that are valid ways to create the string \"python\" in Python.",
    "type": "select_all",
    "options": [
      "word = 'python'",
      "word = \"python\"",
      "word = '''python'''",
      "word = [p,y,t]"
    ],
    "answers": [
      "word = 'python'",
      "word = \"python\"",
      "word = '''python'''"
    ],
    "misconception_map": {
      "word = [p,y,t]": "string_vs_list_confusion"
    },
    "xp": 10
  },
  {
    "module_id": "intro",
    "question_id": "intro-07",
    "prompt": "Select all of the following that are valid ways to create the string \"learning\" in Python.",
    "type": "select_all",
    "options": [
      "word = 'learning'",
      "word = \"learning\"",
      "word = '''learning'''",
      "word = [l,e,a]"
    ],
    "answers": [
      "word = 'learning'",
      "word = \"learning\"",
      "word = '''learning'''"
    ],
    "misconception_map": {
      "word = [l,e,a]": "string_vs_list_confusion"
    },
    "xp": 10
  },
  {
    "module_id": "intro",
    "question_id": "intro-08",
    "prompt": "Select all of the following that are valid ways to create the string \"capstone\" in Python.",
    "type": "select_all",
    "options": [
      "word = 'capstone'",
      "word = \"capstone\"",
      "word = '''capstone'''",
      "word = [c,a,p]"
    ],
    "answers": [
      "word = 'capstone'",
      "word = \"capstone\"",
      "word = '''capstone'''"
    ],
    "misconception_map": {
      "word = [c,a,p]": "string_vs_list_confusion"
    },
    "xp": 10
  },
  {
    "module_id": "intro",
    "question_id": "intro-09",
    "prompt": "What does the following code print?\nword = \"cat\" + \"fish\"\nprint(word)",
    "type": "mcq",
    "options": [
      "catfish",
      "cat fish",
      "cat + fish",
      "An error"
    ],
    "answer": "catfish",
    "misconception_map": {
      "cat fish": "concatenation_adds_space",
      "An error": "concatenation_requires_same_type_fear"
    },
    "xp": 10
  },
  {
    "module_id": "intro",
    "question_id": "intro-10",
    "prompt": "What does the following code print?\nword = \"Cape\" + \"Town\"\nprint(word)",
    "type": "mcq",
    "options": [
      "CapeTown",
      "Cape Town",
      "Cape + Town",
      "An error"
    ],
    "answer": "CapeTown",
    "misconception_map": {
      "Cape Town": "concatenation_adds_space",
      "An error": "concatenation_requires_same_type_fear"
    },
    "xp": 10
  },
  {
    "module_id": "intro",
    "question_id": "intro-11",
    "prompt": "What does the following code print?\nword = \"un\" + \"happy\"\nprint(word)",
    "type": "mcq",
    "options": [
      "unhappy",
      "un happy",
      "un + happy",
      "An error"
    ],
    "answer": "unhappy",
    "misconception_map": {
      "un happy": "concatenation_adds_space",
      "An error": "concatenation_requires_same_type_fear"
    },
    "xp": 10
  },
  {
    "module_id": "intro",
    "question_id": "intro-12",
    "prompt": "What does the following code print?\nword = \"post\" + \"graduate\"\nprint(word)",
    "type": "mcq",
    "options": [
      "postgraduate",
      "post graduate",
      "post + graduate",
      "An error"
    ],
    "answer": "postgraduate",
    "misconception_map": {
      "post graduate": "concatenation_adds_space",
      "An error": "concatenation_requires_same_type_fear"
    },
    "xp": 10
  },
  {
    "module_id": "intro",
    "question_id": "intro-13",
    "prompt": "What does the following code print?\nword = \"play\" + \"ground\"\nprint(word)",
    "type": "mcq",
    "options": [
      "playground",
      "play ground",
      "play + ground",
      "An error"
    ],
    "answer": "playground",
    "misconception_map": {
      "play ground": "concatenation_adds_space",
      "An error": "concatenation_requires_same_type_fear"
    },
    "xp": 10
  },
  {
    "module_id": "intro",
    "question_id": "intro-14",
    "prompt": "print(\"ab\" * 3)",
    "type": "mcq",
    "options": [
      "ababab",
      "ab ab ab",
      "ab3",
      "An error"
    ],
    "answer": "ababab",
    "misconception_map": {
      "ab ab ab": "concatenation_adds_space",
      "ab3": "repetition_confused_with_multiplication"
    },
    "xp": 10
  },
  {
    "module_id": "intro",
    "question_id": "intro-15",
    "prompt": "print(\"ha\" * 2)",
    "type": "mcq",
    "options": [
      "haha",
      "ha ha",
      "ha2",
      "An error"
    ],
    "answer": "haha",
    "misconception_map": {
      "ha ha": "concatenation_adds_space",
      "ha2": "repetition_confused_with_multiplication"
    },
    "xp": 10
  },
  {
    "module_id": "intro",
    "question_id": "intro-16",
    "prompt": "print(\"xo\" * 4)",
    "type": "mcq",
    "options": [
      "xoxoxoxo",
      "xo xo xo xo",
      "xo4",
      "An error"
    ],
    "answer": "xoxoxoxo",
    "misconception_map": {
      "xo xo xo xo": "concatenation_adds_space",
      "xo4": "repetition_confused_with_multiplication"
    },
    "xp": 10
  },
  {
    "module_id": "intro",
    "question_id": "intro-17",
    "prompt": "print(\"na\" * 2)",
    "type": "mcq",
    "options": [
      "nana",
      "na na",
      "na2",
      "An error"
    ],
    "answer": "nana",
    "misconception_map": {
      "na na": "concatenation_adds_space",
      "na2": "repetition_confused_with_multiplication"
    },
    "xp": 10
  },
  {
    "module_id": "intro",
    "question_id": "intro-18",
    "prompt": "print(\"go\" * 3)",
    "type": "mcq",
    "options": [
      "gogogo",
      "go go go",
      "go3",
      "An error"
    ],
    "answer": "gogogo",
    "misconception_map": {
      "go go go": "concatenation_adds_space",
      "go3": "repetition_confused_with_multiplication"
    },
    "xp": 10
  },
  {
    "module_id": "intro",
    "question_id": "intro-19",
    "prompt": "print(len(\"banana\"))",
    "type": "fill_blank",
    "answer": "6",
    "misconception_map": {
      "7": "off_by_one_length"
    },
    "xp": 10
  },
  {
    "module_id": "intro",
    "question_id": "intro-20",
    "prompt": "print(len(\"isiXhosa\"))",
    "type": "fill_blank",
    "answer": "8",
    "misconception_map": {
      "9": "off_by_one_length"
    },
    "xp": 10
  },
  {
    "module_id": "intro",
    "question_id": "intro-21",
    "prompt": "print(len(\"capstone\"))",
    "type": "fill_blank",
    "answer": "8",
    "misconception_map": {
      "9": "off_by_one_length"
    },
    "xp": 10
  },
  {
    "module_id": "intro",
    "question_id": "intro-22",
    "prompt": "print(len(\"flask\"))",
    "type": "fill_blank",
    "answer": "5",
    "misconception_map": {
      "6": "off_by_one_length"
    },
    "xp": 10
  },
  {
    "module_id": "intro",
    "question_id": "intro-23",
    "prompt": "print(len(\"vite\"))",
    "type": "fill_blank",
    "answer": "4",
    "misconception_map": {
      "5": "off_by_one_length"
    },
    "xp": 10
  },
  {
    "module_id": "intro",
    "question_id": "intro-24",
    "prompt": "What happens when Python runs the line: price = hello   (with no quotes around hello)?",
    "type": "mcq",
    "options": [
      "NameError, because Python looks for a variable called hello",
      "price becomes the string 'hello'",
      "SyntaxError immediately, before anything runs",
      "hello is treated as a number"
    ],
    "answer": "NameError, because Python looks for a variable called hello",
    "misconception_map": {
      "price becomes the string 'hello'": "strings_need_quotes"
    },
    "xp": 15
  },
  {
    "module_id": "intro",
    "question_id": "intro-25",
    "prompt": "What happens when Python runs the line: flag = hello   (with no quotes around hello)?",
    "type": "mcq",
    "options": [
      "NameError, because Python looks for a variable called hello",